Section,Subsection,Content
Do,Live music,london is one of the best cities in the world for concerts spanning from new musical trends to wellknown bands between huge concert facilities and small pubs there are hundreds of venues that organise and promote live music every week many concerts especially in smaller or less known places are free so there is plenty of choice even for tourists on a budget london has long been a launchpad for alternative movements from the mods of the 1960s punks of the 70s new romantics of the 80s the britpop scene of the 90s and the indie rock and rock movements in the 21st century it has one of the worlds most lively live music scenes any band heading a british european or world tour will play london not to mention the local talent londons music scene is incredibly diverse covering all genres of music from electrojazz to deathmetal and all sizes of bands from the u2s and rolling stones of the world to bands that disband after their first gig this diversity is reflected in prices as a rough guide £40 and up for top 40 bands in arenasized venues £20 and up for established bands in midsized venues £10 or more for upandcoming bands and club nights in smaller venues £5 and up for new bands in bars and pubs as of 2024 london has hundreds of venues spread out over the city and the best way to know whats going on where is to browse online ticket agenciesmusic magazines gig directories and bands social media pages a few areas which have higher concentrations of pubs and venues than others kilburn in north west london has long been known as an irish area though their numbers have somewhat declined a visit to a local pub will show their influence remains today
Do,Theatre,the west end especially the areas concentrated around leicester square covent garden shaftesbury avenue and haymarket is one of the worlds premier destinations for theatre including musical theatre covent garden has the only actorsponsored school in the city theactors centredead link in the centre of leicester square there is an official halfpricetktsbooth be wary of other ticket offices including those claiming to be the official halfprice ticket office  as these may have higher prices and have been known to sell fake tickets for uptodate listings see the weekly magazinetime outor check theofficial london theatresite the south bank is another area well known for world class theatre and is home to the national theatre and the globe theatre the latter of which is londons only thatched building and an attraction in itself each globe performance has over 700 £5 tickets londons theatre scene outside of these two main districts is known as the fringe several of the larger and more established fringe theatres are an excellent way to see top quality productions of plays that may move to the west end but at lower than west end prices the most significant of these are
Learn,,universities in london london attracts more students from overseas than any other city in the world and is home to a huge variety of academic institutions its universities include some of the oldest and most prestigious in the world theuniversity of londonis a federal university system with many constituent colleges though for all practical purposes each constituent college operates as a separate universitylondon school of economics and political scienceis located on the boundary of covent garden and holborn in westminster 18 nobel prize winners and 50 world leaders have studied here the school offers a wellregarded lecture programme that is open to the public speakers have included tony blair bill clinton the dalai lama and paul krugman event schedule and ticket information available from the lse websiteuniversity college londonacademic research is cited more than any other university in the uk and its courses are regarded as among the best in britain the campus is located just north of the british museum in the literary area of bloomsbury notable alumni include mahatma gandhi alexander graham bell and the british philosopher jeremy bentham whose mummified body is on display at the school in a wooden cabinet called the autoiconimperial college londonis the uks leading university specialising in science engineering business and medicine the campus is located in a beautiful area of south kensington surrounded by numerous cultural institutions including the natural history museum and the victoria  albert museum notable alumni include sir alexander fleming thomas henry huxley and hg wells others includekings college londonschool of oriental and african studiessoasqueen mary university of londonlondon business schooluniversity of middlesexand theuniversity of westminster
Learn,Learn English,london is a natural place to learn and improve spoken and written english there are a huge range of options from informal language exchange services to evening classes and formal language schools there are unaccredited schools charging hefty fees and offering qualifications that are viewed as worthless if choosing a course from a privatelyrun school or college it is important to ensure the institution is accredited by the british council some links to british council accredited schools
Work,,london is one of the worlds leading financial centres and so professional services is the main area of employment it is best to check with recruiters and staffing agencies london is hugely popular as a working holiday destination  work in bars and the hospitality industry is relatively easy to find wages are generally higher in london than the rest of the uk in part due to the addition of london weighting although the cost of living is higher still
Buy,Money,london like the rest of the uk uses the british pound sterling retail prices for most items with a few exceptions always include vat at 20 visa and mastercardmaestro are the two most commonlyaccepted debitcredit cards although most large shops will also accept american express if your card does not have a microchip for chip  pin some machines for instance at tube stations will be unable to read your card some shops may ask you for additional identification especially in relation to highvalue items or items that are under agerelated restrictions most shops no longer accept personal cheques contactless or nfcenabled visa and mastercard cards can also be used for purchases of usually up to £100 in lieu of chip  pin even on london underground fare gates and buses £50notes are not often used in everyday transactions and most shops will not accept them when exchanging money at a bureau de change make sure to ask for £5 £10 and £20 notes only the bank of englandsguide to bank notesmay be of use london and england are some of the worst places toexchange money included fees in the exchange rate of up to 50 are not uncommon do not get fooled by theno commissionstatement that many bureaux de change make this is a trick and actually a blunt lie because the exchange rates are just made so bad so that they cover for any necessary commissions so how do you identify a decent exchange rate basically the spread between the buy and sell rate tells you what is the fee divided by 2 actually—anything above 10 is a ripoff 5 is good 1 is excellent but forget about it in the uk you are better off withdrawing money from atms here neverattempt to change money on either leicester square or tottenham court road rates in either one of those places can be subject to interpretation by the individuals behind the counter
Buy,Shopping,london has a justified reputation for being one of the worlds most expensive cities but if you do your homework beforehand there are ways to limit the damage and prices for basic items are in general not as exorbitant as in the nordic countries or switzerland london is one of the worlds most fashionconscious cities it has an abundance of clothing shops from the flagship stores ofoxford streetto the tiny boutiques ofbrick lane though not particularly known for bargain shopping nearly anything you could possibly want to buy is available in london during major sales such as the annual boxing day sale after christmas and black friday in late november an event imported from the us you price for some items are lowered by up to 70 meaning that it is possible to find bargains for genuine luxurybranded goods if you are there at the right time in central london the main shopping district is the west end bond street covent garden oxford street and regent street on thursdays many west end stores close later than normal 78pm
Buy,Markets,borough marketis a great if expensivefood market offering fruit vegetables cheese bread meat fish and so on much of it organic the market opens thsa many stalls offer freshly made fast food on the spot for lunch from ostrich burgers to falafel most tastes are catered for tube london bridge old spitalfields marketis an excellent market for clothes from upandcoming designers records housewares food and all things trendy tube liverpool street also be sure to check outbrick lane marketgreenwich marketandportobello road market
Buy,Tax-free,taxfree shops in airports are not strong in variety prices are equal to london and they close rather early as well shop listings at airport web sites can help to plan your taxfree vs traditional shopping in the evening allow an extra half hour as closing hours are not always strictly respected nevertheless taxfree at the airport does not mean cheaper prices are determined by the shop owner at their own discretion and due to the large crowds high shop rents and free marketing there is no real reason why anyone should offer prices below average also often goods sold here have different sizes than in regular stores making it harder to compare furthermore taxfree shops mostly only offer expensive brands and no cheap nonbrand stuff like simple sun glasses either way you are better off doing your shopping somewhere else nevertheless a different matter istax reclaim many big department stores in central london have an information booth where they can give you the paperwork needed to reclaim tax on purchases made at the store when you get to the airport
Eat,,for suggestions of specific restaurants have a look into thedistrict articles it is a huge task for a visitor to find the right place to eat in london  with the right atmosphere at the right price  largely because as in any big city there are literally thousands of venues from which to choose ranging from fast food joints pubs and mainstream chains all the way up to some of the most exclusive restaurants in the world which attract the kind of clientele that dont need to ask the price sorting the good from the bad isnt easy but london has something to accommodate all budgets and tastes as london is one of the worlds most multicultural cities it is possible to find virtually every cuisine from around the world here if you look hard enough following is a rough guide to what you might get should you fancy eating out smoking ban smoking is illegal in all enclosed and indoor public spaces in the uk prices inevitably become inflated at venues closest to major tourist attractions  beware the socalled tourist traps the worst tourist trap food in the opinion of many londoners is served at the various steak houses angus steak house aberdeen steak house etc  they are all dotted around the west end and near the main train stations londoners wouldnt dream of eating here  you shouldnt either notorious areas for inflated menu prices trading on travellers gullibility and lack of knowledge are the streets around the british museum leicester square and piccadilly circus even the major fast food chains charge a premium in their west end outlets  so watch out pubs in the touristy areas of london are usually a poor choice for food although there are some brilliant gastropubs hidden away in general avoid all pubs that have graphicdesigned and printed menus look around you  see any locals tucking in no  then you shouldnt either the other rule to follow when avoiding poor food is the same as in any other part of europe  is the menu available in multiple languages if yes then start running in the suburbs the cost of eating out is reduced drastically particularly in large ethnic communities there is a competitive market which stands to benefit the consumer in east london for example the vast number of chicken shops means that a deal for 2 pieces of chicken chips fries and a drink shouldnt cost you more than £3 especially onbrick lane brick lane is also known for being home to londons version of thebeigelspelt bagel in the united states and canada but pronounced the same way withbrick lane beigel bakeandbritains first  best beigel shopbeing among the sole remnants of what was once a thriving jewish community in the neighbourhood both shops are also known for theirsalt beef londons version of jewishstyle cured meats and a popular filling in their beigel sandwiches another good and cheap lunch option is a chicken or lamb doner gyro at many outlets throughout the city though meat quality is often poor for more authentic cockney food trypie and mash which originates from the workingclass in the east end usually minced beef and cold water pastry pie served with mashed potato mushy peas and liquor gravy it tastes a lot better than it sounds some of the best pie houses arem manzein peckham orf cookein hackney broadway market water souchet and london particular greenpea and ham are classic cockney soups though hard to find on menus for those gamejellied eels pickledcockles and whelks are all traditional london seafood its peoples experiences in these kind of places that gives britain a bad name for food thesouth banksborough marketoffers wholesale produce as well as individual stalls that sell small bites and drinks for a casual and cheap mealkappacasein dairyhas a popular stand in the market famous for their grilled cheese which has earned the praise of giada de laurentiis and ruth reichl of course the quintessential british dishfish and chipsis widely available in london but the standards can be pretty disappointing in the tourist trap pubs the bestrated fish and chips shops in london are generally located in the suburbs away from all the tourist fare in central london for hamburgers local chainburger  lobsteris an excellent choice for gourmet burgers tipping may also be different than what youre used to all meals include the 20 vat tax and some places include a service fee 1012 the general rule is to leave a tip for table service unless theres already a service charge added or unless the service has been notably poor the amount tipped is generally in the region of 10 but if theres a figure between 1015 which would leave the bill at a conveniently round total many would consider it polite to tip this amount tipping for counter service or any other form of service is unusual  but some choose to do so if a tips container is provided
Eat,Restaurant streets,while central london is full of restaurants and cafes there are some areas where the majority of diners are londoners rather than tourists and in general you will get a much more pleasant better value and less crowded eating experience than you will find in the west end these places are best visited in the evenings
Eat,Restaurant areas,as one of the worlds most cosmopolitan cities you can find restaurants serving food cuisine from nearly every country some of it as good as if not better than in the countries of origin indian food in london is especially famous and there is hardly a district without at least one notable indian restaurant london also has excellent options for chinese in particular cantonese food local chainroyal chinais an excellent option if you are looking for highend fine dining dim sum if you are looking for other particular regional foods these tend to be clustered in certain areas andsomeexamples are other nationalities are equally represented and randomly dotted all over london it is usually wisest to eat in restaurants on main thoroughfares rather than on quiet backstreets
Eat,Fast food and chains,like other capitals in the world london has the usual array of fast food outlets sandwich shops are the most popular places to buy lunch and there are a lot of places to choose from including the ubiquitous pret a manger some italianstyle sandwich shops have a very good reputation and you can identify them easily by looking at the long queues at lunchtime if all else fails central london has lots of minisupermarkets operated by the big british supermarket chains eg sainsburys tesco where you can pick up a prepacked sandwich fast food with an asian flair is easy to find throughout the city with lots of busaba eathai wagamama and yo sushi locations throughout the city nandos a popular pseudoportuguese restaurant chain has spicy periperi style grilled chicken for burgers gbk gourmet burger kitchen has been joined by other franchises such as byron and haché
Eat,Vegetarian and vegan,london has plenty of vegetarian and vegan restaurants many of them championing organic foodstuffs and a quick search in google will produce plenty of ideas so you never have to see a piece of cooked meat all week hackney dalston islington soho peckham and brixton are particular vegan hotspots if you are dining with carnivorous friends most restaurants will cater for vegetarians and will have at least a couple of dishes on the menu indianbangladeshi restaurants are generally fruitful as they have plenty of traditional dishes good indianbangladeshi options can be found in the brick lane area of spitalfields or further afield in east ham tooting broadway and southall these also tend to be very cheap eats with authentically prepared dishes with a true local ambience there are also many vegetarian thai buffet places where you can eat fake meat in toothachingly sweet sauces for under £5 these can be found on greek street and old compton street insohoandislington high street mildreds is a great veggie chain with a handful of locations around london if youre interested in vegan versions of classic british dishes try fish and chips from sutton and sons inhackney and various cafes offer veggie interpretations of a full english breakfast
Eat,Religious,due to the mix of cultures and religions many london restaurants cater well for religious dietary requirements the most common signs are for halal and kosher meat from burger joints to nice restaurants there are lots of halal restaurants and shops all over london including whitechapel rd and brick lane inthe east endbayswater edgware rd and paddingtonand in many parts ofnorth london there are plenty of kosher restaurants ingolders greenedgwareandstamford hillalong with some central delis such as on charing cross road
Eat,Convenience stores and supermarkets,convenience stores such as tesco metro sainsburys centrallocal budgens costcutter spar coop and privatelyrun corner shops will sell premade sandwiches snacks alcohol cigarettes drinks etc most are open from 5am11pm although some such as tesco metro or convenience stores located at petrol stations may open 24 hours some will stop selling alcohol after a certain time whistlestop convenience stores usually found in or around train stations are notoriously overpriced and should be avoided if using a petrol station convenience store late at night ie after 11pm the store will be locked and you should order and pay through the external service window although tesco sainsburys and other supermarkets run smaller stores in central london fullsize superstores including morrisons and asda are rare in the city centre  with the exception of the sainsburys in pimlico  and you will usually have to take a 15 to 20minute tube ride to reach one the closest large stores to central london are marks  spencer an upmarket retailer also operate food halls branded as simply food they can be foundacross central london the smaller stores such as those found in train stations tend to focus mostly on readytoeat food such as sandwiches drinks snacks and also essentials such as bread and milk
Drink,,london is home to a great many pubs bars and nightclubs the online city guideview londonand the weekly magazinetime outtell whats going in londons night life as well as cultural events in general
