Section,Subsection,Content
Get around,By Underground,thelondon underground known popularly asthe tubedue to its tubelike tunnels drilled through the london clay is a network of 11 lines which crisscross london in one of the largest underground rail networks in the world it was also the first the oldest section from paddington to farringdon opened as the metropolitan railway in 1863 the tube is an easy method of transport even for new visitors to london and is equivalent to subway and metro systems in other world cities the routes operated by the london underground fall into 2 broad types the older subsurface lines encompassing the metropolitan district circle and hammersmith  city lines date from the 19th century the deep level routes were largely constructed in the earlytomid20th century the subsurface lines are usually accessed by walking down a short set of stairs whereas the deeplevel lines are accessed by a complicated network of escalators or lifts it is the deep lines which are served by the iconic tubeshaped trains which despite their small size can only just fit through the tunnels however the deeplevel trains do not have air conditioning which can make them unbearably hot in the summer each line has stations with interesting architectural and artistic features typical of the era they were opened as you travel around the network look out for victorian finery edwardian glazed tiles smooth art deco symmetry and striking modern masterpieces various conservation pieces are also present such as the heritage 1900s station name roundel sign at caledonian road on the westbound platform trains on most days and on most lines run from around 530am to around 1am they are usually the fastest way to travel in london the only problem being the relative expense and the fact that they can get extremely crowded during rush hours 73010am and 4307pm there is no air conditioning on the deeplevel trainstfls websitehas a page notifying of tracking delays closures and planned engineering works which you should check if you plan to travel on a saturday or a sunday when entire lines may be shut down due to engineering works if youre travelling around central london then taking the tube for just one stop can be a waste of time for example to travel between leicester square and covent garden stations takes over 10 minutes on the tube despite the two stations being only a few minutes walk apart this is especially true since the walk from a tube station entrance to the platform at some central stations can be extensive the tube map also gives no information on londons extensive bus network or any of its national rail network except for thameslink for more information see theby foot section thenight tube introduced in 2016 is a limited 24hour tube service that operates on certain lines on fridays and saturdays night tube fares are the same as the offpeak fares during the day day travelcards are valid on the day they were issued using the date printed on the card and for journeys starting before 430am the following day for example if you buy a day travelcard at 11am on friday you can use it until 429am on the following saturday daily capping on oyster cards and contactless payment cards also applies as of april 2022 the night tube runs on the following lines itusedto run on some other lines but this has been curtailed due to the coronavirus also note that until june 2022 there are strikes that can affect the night tube service for the central and victoria lines which the former likely to be more severe travel on the tube system will always require the purchase of a ticket or the use of an oyster card or contactless payment card if you have one fare evasion is treated as a serious matter and will get you a fine single tickets are charged at two rates depending on the payment method cash fares and single oyster fares are zonal meaning that the price of a journey is determined by the zones you travelled through there are additional fares payable for zones beyond 9 but these are mostly outside what is considered london paper travelcards valid for 1 day or 7 days are also available and can also be used on buses national rail trains the dlr and croydon tramlink  however there is a capping feature for contactless and oyster cards which guarantees a strict upper bound on the fare you pay for a day and a week which means that a paper travelcard is unnecessary and costlier almost all stations have automatic ticket barriers if you pay by oyster card or a contactless payment card just tap your card against the yellow pad to open the barriers ensure that you do this upon both entrance and exit if you have a paper ticket insert it faceup into the slot on the front of the machine and remove it from the top to enter the station if you have a single ticket it will be retained at the exit gate if you have luggage or if your ticket is rejected there is normally a staffed gate as well paper tickets can be purchased from vending machines in the stations ticket hall the touchscreen machines have instructions in multiple languages offer a greater choice of ticket and accept bills and creditdebit cards if your card has no embedded microchip you cannot use these machines these machines do not support contactless you can also add oyster payasyougo credit on many mainline ticket vending machines in london if you have a national train ticket which involves travelling across london egbrightontodarlington you may be able to travel on the tube across london from one london terminus to another if your train ticket has any permitted † with the dagger symbol written in the route section at the bottom of the ticket then you are able to travel on the tube without buying another ticket these can be used at the ticket barriers in the same way as the paper tickets described above all lines are identified by name eg circle line central line piccadilly line many lines have multiple branches rather than running pointtopoint so always check the trains destination which is shown on the front of the train and the platform indicator screens and will be broadcast on the trains pa most branches are only served by specific services from the eastern end of the district line at upminster for instance you can only catch trains for ealing broadway and richmond  if you want to go to wimbledon you will have to change trains later down the line trains stop at all stations with the exception of the metropolitan line which during peak hours runs semifast and fast trains that skip some stations signs can be seen to be vague especially if you are unfamiliar with what compass point direction eg northbound youre travelling in as these are most often given rather than destinations a person new to the tube can become very frustrated trying to work out where a particular connection at a particular station is found each station is staffed by at least two personnel at all times who can advise you on your route and full system maps are on the walls of every platform and ticket office additionally on every platform there are individual line maps showing all the stations served by trains calling at that platform google maps is another handy tool the tube is made up of 11 lines each bearing a traditional name and a standard colour on the tube map you can change between lines at interchange stations providing you stay within the zones shown on your ticket since the tube map is well designed it is very easy to work out how to get between any two stations and since each station is clearly signed it is easy to work out when to exit your train the tube map is a diagram and not a scaled map making it misleading for determining the relative distance between stations as it makes central stations appear further apart and somewhat out of place  the most distant reaches of the metropolitan line for example are almost 64 km 40 mi from the centre of the city tube maps are freely available from any station most tourist offices and are prominently displayed in stations thenational rail mapshowing national rail services is displayed as a large poster at most tube stations direction signs for the platforms indicate the geographical direction of the linenotthe last stop of the line it is always advisable to carry a pocket tube map to help you with this thenorthern linehas two routes through central london which split at euston and rejoin at kennington one the charing cross branch runs through the west end while the other route runs via the city of london called the bank branch or the city branch it is fairly easy to work out which way your train is going check the signs above the platform and on the front of the train the trains destination and central branch will also be announced on board for example this train is for edgware via charing cross the london underground has connections to all terminals at heathrow including terminals 4  5 and most major london rail termini with the exception of fenchurch street interchange hubs are also served such as farringdon elephant  castle harrow  wealdstone and stratford be considerate of your fellow passengers as best you can pushing and rushing are seen as extremely rude  theres not much need to run for a tube train unless its the very last one of the day also trying to strike up a conversation with strangers is seen as peculiar and will instantly mark you out as a tourist despite having a reputation as being aloof londoners are usually happy to help out if you have a problem but otherwise theyd rather you didnt try to be overly familiar in some cases particularly for the subsurface lines the tube doors have buttons on the outside they normally come to use if a train is waiting for over 45 seconds as the doors will automatically close to conserve energyifthe train isnt ready to depart which is easy to check  if the button isnt illuminated the train is ready to depart pressing the button will open the doors when using the escalatorsalways stand on the rightto allow people in a hurry to pass drinking alcohol or smoking anywhere on the london underground is illegal crime levels on the tube are comparable to but typically lower than in many other subway systems and traveller advice about watching luggage and valuables is reasonable the tube system is covered by an extensive cctv system although it is not advised to be reliant on this fact when travelling the london underground considers its safety record to be a matter of professional honour major incidents being incredibly rare despite the media attention they generate frontline staff are well trained for emergencies and will follow wellrehearsed procedures in addition frontline staff are generally appreciative of traveller vigilance if concerns are politely expressed if you notice something that concerns you please speak to a member of staff or a british transport police officer on the wall of the platforms or freestanding on outdoor platforms there will be a round white device labelled help point with one or two buttons and a fire alarm press the green button to alert staff to an emergency and press the blue button to ask for nonurgent assistance if you see smoke or fire always use the fire alarm first on tube trains you will notice that there is a red handle you can pull to alert the driver to a serious incident or accident occurring on the train if the train is in a tunnel the alarm should only be used in dire emergencies that require immediate attention as pulling the alarm will activate the trains brakes in practice when the alarm is activated a driver will move the train forward into the next station where help can be obtained therefore the alarms should only be used in stations if possible as passengers will then be able to escape the train quickly if needed tfl advise travellers to carefully consider their usage of the passenger alarm and if suitable leave the train at the next station and seek help from station staff instead because trains on the london underground are run close together any delays can have serious knockon effects for the rest of the service in contrast train drivers vary in their opinion as to when the alarm should be used consensus tends to be that if its something you would run down the train to tell the driver then the alarm should definitely be used owing to a heightened security climate and a history of political violence targeting the tube unattended baggage may be treated as a suspect or explosive device and may be destroyed lost items if not destroyed will end up at thelost property officeand will be stored for 3 months you will need to fill in a form online describing your lost item and tfl will contact you if it is found there is a charge for recovery of most items however some items eg laptops have higher fees 
Get around,By bus,londons iconic redroutemasterbuses which are recognised the world over were withdrawn from regular service in 2005 although a heritage service was continued on portions of two routes this ceased in 2019 routemasters are still used for tours and private parties buses are generally quicker than taking the tube for shorter less than a couple of stops on the tube trips and out of central london youre likely to be closer to a bus stop than a tube station most buses in london are very frequent at least every ten minutes and are accessible for buggies and wheelchairs buses also have a flat rate fare which stays the same no matter how far you travel you will need to pay the fare again if you board a different bus although the hopper fare allows you to take as many buses as you like in 62 minutes and only pay for the first one over 5 million bus trips are made each weekday with over 700 different bus routes you are never far from a bus each bus stop has a sign listing the routes that stop there and bus routes are identified by numbers and sometimes letters buses have very clearblindson the front with their route number and their destination transport for london produces allbus route maps bus tips when you see your bus approachingsignal clearly to the driverthat you intend to get on their bus the way to do this is to stick your hand out with an open palm the driver will indicate and pull into the stop always wait for people to get off the bus before you enter most buses havetwo doors form an orderly queue at the front door when you reach the driver touch your oyster or contactless card on the reader or show them your travelcard or pass importantly cash isnotaccepted some buses are worked by the new routemaster you can get on this bus at any of its three doors as long as you touch in your oyster or contactless card as soon as you board it should be noted that unlike the tube you are allowed to use an oyster card which has zero but not negative or insufficient balance  this will cause the balance to be negative the machines will flash an emergency fare charged message which is the same as the normal fare however you must then recharge before the card can be used again if you are a wheelchair user you should indicate as normal and wait by the second door from the front the driver will activate the wheelchair ramp for you to use most buses have a system that provides visual and audible announcements of the buss destination at every stop the stops and nearby landmarks when you are nearing your stop press one of the red stop buttons on the handrailsonce only youll hear a bell or a buzzer and the words bus stopping will appear on the destination screen get off the bus using the middle or rear door there is also a blue stop button by the wheelchair space  this indicates to the driver that the wheelchair ramp is required at the next stop finallyalways watch out for moving traffic cyclists and pedestrians when you get off the bus it isnot possible to buy tickets on the busso you must have a valid travelcard oyster card or contactless credit or debit card before you get on alternatively tickets may be purchased from most newsagents in london or from ticket machines at certain central london stops the adult bus fare is £165 discounts are available to holders of certain cards that must be applied for in advance unlike on the tube you are charged for each bus you travel on if you change buses then you will normally be charged a new bus fare up to the dailyweekly price cap however thehopper fareallows you to make unlimited bus or tram journeys for the price of one if you use an oyster card or contactless payment method all of your journeys must be made within an hour of touching in on the first bus or tram you are travelling on and you must also use the same oyster or contactless card for the other journeys if you have a sevenday monthly or yearly travelcard or bus and tram pass on your oyster that includes free bus travel across all of london even outside the zones of your travelcard buses arent subject to zones you still must touch in when you get on the bus but you wont be charged if you do not have a travelcard the fare is taken from your oyster pay as you go credit as soon as you touch in when you get on the bus daily bus and tram travel is capped so you generally wont pay more than an equivalent travelcard unlike the tube you are allowed to use an oyster card which has zero but not negative or insufficient balance  this will cause the balance to be negative the machines will flash an emergency fare charged message which is the same as the normal fare however you must then recharge before the card can be used again touch your oyster on the reader as soon as you get on the bus or you may be liable to a penalty fare or prosecution you can also pay for with most contactless debit credit or prepaid visa mastercardmaestro or american express cards you touch the card flat against the reader like you would with an oyster card but your account is charged instead some foreignissued cards will not work for contactless payment the total charges for that day are calculated and taken out of your account overnight as with oyster you are charged for each bus fare up to a cap each day in addition a weekly price cap applies from monday to sunday seeabovefor further information on contactless payment children aged 10 and under travel for free on the bus when accompanied by an adult children between the ages of 11 and 15 must touch in using a zip card yet journeys are still free on buses if they do not have a zip card they must pay the full fare using an adult oyster or contactless card 1618 student oyster cards only available to students studying in london go up to age 18 and journeys are still free residents of england who have an encts free bus pass for the elderly or disabled also get free travel simply show your pass to the driver or conductor night bus hints standard bus services run from around 6am1230am around half past midnight the network changes to the vast night bus network of well over 100 routes stretching all over the city there are two types of night buses 24hour routes and nprefixed routes 24hour services keep the same number as during the day and will run exactly the same route such as the number 88 for example nprefixed routes are generally very similar to their dayroute but may take a slightly different route or are extended to serve areas that are further out for example the 29 bus goes from trafalgar square to wood green during the day however the n29 bus goes from trafalgar square to wood green and then continues to enfield night buses run at a 30minute frequency at minimum with many routes at much higher frequencies up to every 5 minutes prices stay the same and daily travelcards are valid until 0429 the day after they were issued so can be used on night buses most bus stops will have night bus maps with all the buses to and from that local area on it although it is good to check on the tfl website beforehand which also has all those maps easily available
Get around,By DLR,docklands light railway dlris a dedicated light rail network operating ineast london connecting with the tube network at bank tower gateway close to tower hill station canning town heron quays close to canary wharf tube station and stratford as the trains operate automatically it can be quite exciting – especially for children – to sit at the front and look out through the window whilst feeling as though one is driving the train oneself the dlr runs above ground on much of its route and travels through many scenic parts of london including the docklands area where most of londons skyscrapers are located the dlr can be a little confusing as the routes are not easily distinguished however there are network maps on the train and the platform check the displays on the platform which will show you the destination and the wait for the next three trains and also check the destination displays on the front and side of the train and listen for announcements at busy times some trains do not run the full length of the route in this instance you should take the first train listen for announcements and change where necessary be extra careful atcanning townstation as it is very busy and the line divides into two sections  one heading to woolwich arsenal and the other heading to beckton always check the destination on the front of the train before getting on especially at offpeak times when there may not be a return train for a good few minutes if you end up on the wrong branch unlike on the tube most dlr stations do not have ticket gates except for bank and stratford as they are unstaffed also unlike the tube youdoneed to push the buttons to open the doors you can top up an oyster card buy a travelcard or buy a paper ticket at a substantial premium from the ticket machines at the station most stations are unstaffed so if you want to pay by cash then make sure you have plenty of change as there are no gates when travelling by oyster you must always remember to touch in at the start of your journey and touch out at the end even if you are changing to the underground at canary wharfheron quays you must still touch inout at the dlr station the system will recognise that you have made an interchange between the two stations and treat it as part of the same journey
Get around,By train,the british railway system is known asnational railalthough some older signs still refer to it as british rail londons suburban rail services are operated by several private companies under tightlywritten government contracts and mostly run in the south of the city away from the main tourist sights only one line thameslink runs through central london  on a northsouth axis between london bridge or blackfriars stations and the underground level of st pancras main line station there is no one central station  instead there are twelve mainline stations dotted around the edge of the central area and most are connected by the circle line except euston fenchurch street and those south of the river like waterloo and london bridge most visitors will not need to use national rail services except for a few specific destinations such as wimbledon hampton court kew gardens kew bridge station windsor castle greenwich or the airports or indeed if they are intending to visit other destinations in the uk its important to know that the quickest route between two stations is often a combination of the tube as well as national rail trains for instance if you are going from central london to wimbledon it will usually be much quicker to go to waterloo and take the first wimbledon train around 15 minutes maximum rather than take the district line which can take up to 45 minutes your payasyougo oyster card is valid in london zones 19 and some extensions but not beyond so be careful — if you want to travel beyond the london zones you will need to buy a paper ticket from the ticket office at the station if you travel beyond the london zones with no valid ticket you will be charged a penalty fare on national rail services this is usually £20 you will have to buy another ticket for the remainder of your journey and you will also be charged the maximum oyster fare because you didnt touch out this adds up to a lot so be careful and make sure you plan your journey if in doubt ask at the ticket office importantly there are stations where contactless paymentbut notoyster is accepted  watch out for them there are express trains to and from heathrow gatwick and stansted airports tickets are often sold at a substantial premium so you may want to consider taking the slightly slower stopping services instead for instance an anytime single from victoria to gatwick costs more on the gatwick express then when marked route southern only—taking a southern train to gatwick is only eight minutes longer similarly while the journey from paddington station to heathrow airport by elizabeth line will take around 1015 minutes longer than by heathrow express the walkup fare will be twice as cheap and even cheaper on the tube though the journey takes considerably longer so its often only worth the premium when youre in a hurryoyster cards are only validto heathrow when travelling by tube heathrow express or the elizabeth line to gatwick by national rail including gatwick express and to city by dlr to all other airports they are not valid dont throw your ticket away until youre out of the station at your destination many stations have ticket gates which you will need to put your ticket through to exit also you need to retain all the parts of your ticket throughout your journey as a member of railway staff may need to see it
